<?xml version="1.0" encoding="UTF-8"?>
<pmd xmlns="http://www.evolved-intelligence.com/pmd/version2"
     xmlns:xsi="http://www.w3.org/2001/XMLSchema-instance"
     xsi:schemaLocation="http://www.evolved-intelligence.com/pmd/version2 http://www.evolved-intelligence.com/pmd/schema/evolved-intelligence-pmd-v2.xsd">

    <settings>
        <variables>
            <var name="DIF_BASE" val="/opt/engine" />
            <!-- The DIF has to be in the same process group as the diameter watchdog passive monitor -->
            <var name="DIF_GRP_NAME"      val="diameter" />
            <var name="DIF_PROC_NAME"     val="tcp-diam-watchdog" />
        </variables>
    </settings>

    <group name="${DIF_GRP_NAME}">
        <processes>
            <process name="${DIF_PROC_NAME}"/>
        </processes>
    </group>

    <process name="${DIF_PROC_NAME}"
             path="${DIF_BASE}/bin"
             dir="${DIF_BASE}/bin"
             cmd="./start-ei-diam-watchdog.sh">
        <envEntry var="DIF_JAVA_XMS_ARG"      val="32m"/>
        <envEntry var="DIF_JAVA_XMX_ARG"      val="64m"/>
        <envEntry var="EI_DIAM_WATCHDOG_CONFIG_FILE" val="/opt/engine/conf/EIDiameterStackWatchdogConfig.json"/>
    </process>
</pmd>
