<?xml version="1.0" encoding="UTF-8"?>
<pmd xmlns="http://www.evolved-intelligence.com/pmd/version2"
    xmlns:xsi="http://www.w3.org/2001/XMLSchema-instance"
    xsi:schemaLocation="http://www.evolved-intelligence.com/pmd/version2 http://www.evolved-intelligence.com/pmd/schema/evolved-intelligence-pmd-v2.xsd">
    <!-- Need schemaLocation or entityResolver is not invoked -->

    <settings>
        <variables>
            <var name="SORPMON_BASE" val="/opt/pmon-steering"/>
        </variables>
    </settings>

    <group name="sorpmon">
        <processes>
            <process name="sorpmon"/>
        </processes>
    </group>

    <process name="sorpmon"
             path="${SORPMON_BASE}/bin"
             dir="${SORPMON_BASE}/bin"
             cmd="./pmon_sorlocmgmt">

        <args>${SORPMON_BASE}/conf/pmon_sor.cfg</args>

        <envEntry var="LD_BIND_NOW" val="1"/>
        <envEntry var="DB_PRINT" val="0"/>
        <envEntry var="DB_COMPDEBUG" val="1"/>
        <envEntry var="DLVL_pmon" val="0"/>
        <envEntry var="DLOG_pmon" val="${SORPMON_BASE}/logs/pmon.log"/>
        <envEntry var="DCFG_pmon" val="${SORPMON_BASE}/conf/pmon_log.cfg"/>
    </process>

</pmd>
