<?xml version="1.0" encoding="UTF-8"?>
<pmd xmlns="http://www.evolved-intelligence.com/pmd/version2"
    xmlns:xsi="http://www.w3.org/2001/XMLSchema-instance"
    xsi:schemaLocation="http://www.evolved-intelligence.com/pmd/version2 http://www.evolved-intelligence.com/pmd/schema/evolved-intelligence-pmd-v2.xsd">
    <!-- Need schemaLocation or entityResolver is not invoked -->

    <settings>
        <variables>
            <var name="SCTPWATCHDOG_BASE" val="/opt/pmon-sctp-watchdog" />
            <!-- The watchdog pmon must run in the same, lockstep,
               - group as the Telesoft relay stack.  -->
            <var name="PMON_GRP_NAME"     val="sctp" />
            <var name="PMON_PROC_NAME"    val="sctpwatchdogpmon" />
        </variables>
    </settings>

    <group name="${PMON_GRP_NAME}" lockstep="true">
        <processes>
            <process name="${PMON_PROC_NAME}"/>
        </processes>
    </group>

    <process name="${PMON_PROC_NAME}"
             path="${SCTPWATCHDOG_BASE}/bin"
             dir="${SCTPWATCHDOG_BASE}/bin"
             cmd="./pmon_sctpwatchdog">

        <args>${SCTPWATCHDOG_BASE}/conf/pmon_sctpwatchdog.cfg</args>

        <envEntry var="LD_BIND_NOW" val="1"/>
        <envEntry var="DB_PRINT" val="0"/>
        <envEntry var="DB_COMPDEBUG" val="1"/>
        <envEntry var="DLVL_pmon" val="0"/>
        <envEntry var="DLOG_pmon" val="${SCTPWATCHDOG_BASE}/logs/pmon.log"/>
        <envEntry var="SLOG_pmon" val="${SCTPWATCHDOG_BASE}/stats/pmon_stats.log"/>
        <envEntry var="DCFG_pmon" val="${SCTPWATCHDOG_BASE}/conf/pmon_log.cfg"/>
    </process>

</pmd>
