<?xml version="1.0" encoding="UTF-8"?>
<pmd xmlns="http://www.evolved-intelligence.com/pmd/version2"
    xmlns:xsi="http://www.w3.org/2001/XMLSchema-instance"
    xsi:schemaLocation="http://www.evolved-intelligence.com/pmd/version2 http://www.evolved-intelligence.com/pmd/schema/evolved-intelligence-pmd-v2.xsd">
    <!-- Need schemaLocation or entityResolver is not invoked -->

    <settings>
        <variables>
            <var name="DIAM_SFW_BASE"   val="/opt/pmon-diametersfw" />
            <var name="PMON_GRP_NAME"   val="diamsfwpmon" />
            <var name="PMON_PROC_NAME"  val="diamsfwpmon" />
        </variables>
    </settings>

    <group name="${PMON_GRP_NAME}">
        <processes>
            <process name="${PMON_PROC_NAME}"/>
        </processes>
    </group>

    <process name="${PMON_PROC_NAME}"
             path="${DIAM_SFW_BASE}/bin"
             dir="${DIAM_SFW_BASE}/bin"
             cmd="./pmon_diamsfw">

        <args>${DIAM_SFW_BASE}/conf/pmon_diamsfw.cfg</args>

        <envEntry var="LD_BIND_NOW" val="1"/>
        <envEntry var="DB_PRINT" val="0"/>
        <envEntry var="DB_COMPDEBUG" val="1"/>
        <!-- <envEntry var="DB_MAXLOGSIZE" val="60MB"/> -->
        <envEntry var="DLVL_pmon" val="0"/>
        <envEntry var="DLOG_pmon" val="${DIAM_SFW_BASE}/logs/pmon.log"/>
        <envEntry var="SLOG_pmon" val="${DIAM_SFW_BASE}/stats/pmon_stats.log"/>
        <envEntry var="DCFG_pmon" val="${DIAM_SFW_BASE}/conf/pmon_log.cfg"/>
    </process>

</pmd>
